<window xmlns:xsi="http://www.w3.org/2001/XMLSchema-instance" xsi:noNamespaceSchemaLocation="../../../../java/com/ldtteam/blockout/blockOut.xsd"
        pause="false" lightbox="true">
    <label size="100% 9" pos="0 25" textalign="MIDDLE" color="white"
           label="$(com.ldtteam.structurize.gui.tagtool.currenttag)"/>
    <input id="currentTag" size="150 18" pos="135 40" maxlength="30"/>

    <label id="taglistname" size="230 12" pos="135 65" color="white" label="$(com.ldtteam.structurize.gui.taglist.title)"/>

    <list id="tagposlist" size="230 120" pos="135 80" childspacing="-1">
        <box size="100% 17" linewidth="1">
            <itemicon id="posblock" size="17 17" pos="0 1"/>
            <text id="tagnames" size="190 25" pos="30 5" textalign="TOP_LEFT" color="white"/>
            <buttonimage id="removeTag" pos="207 1" size="15 15" source="structurize:textures/gui/builderhut/button_x.png" color="black"/>
        </box>
    </list>

    <label id="taglistname" size="130 12" pos="0 65" color="white" label="$(com.ldtteam.structurize.gui.tagoptions.title)"/>
    <list id="tagoptionlist" size="130 120" pos="0 80" childspacing="-1">
        <box size="100% 17" linewidth="1">
            <text id="tagnames" size="190 25" pos="5 5" textalign="TOP_LEFT" color="white"/>
            <button id="select" pos="104 1" size="16 16" source="structurize:textures/gui/builderhut/checkbox_empty.png" color="black"
                    disabled="structurize:textures/gui/builderhut/checkbox_checked.png"/>
        </box>
    </list>

    <button label="$(com.ldtteam.structurize.gui.tagtool.close)" id="closeUI" pos="300 205" size="86 17"
                 source="structurize:textures/gui/builderhut/builder_button_medium.png" color="black"/>

    <buttonimage id="cancel" source="structurize:textures/gui/builderhut/button_x.png" size="13 16" pos="325 5"/>
</window>
